gen_id,doc_id,partition_name,system,home_name,vis_name,line_id,len(t),text,len(detokenized_text),detokenized_text,date,bref_box,bref_home,bref_visiting,calendar,s3_file
15,S022,00_Existing,rebuffel_test_gen_not_paper.txt,Timberwolves,Pelicans,562,1505,"The New Orleans Pelicans defeated the Minnesota Timberwolves , 122 - 106 , at Target Center on Friday . These are two teams going in opposite directions and this result shows just that . In this game , there were 8 ties and 10 lead changes in total , with neither team leading by more than 8 points . Defense was key for the Pelicans , as they held the Timberwolves to 46 percent from the field and 22 percent from three - point range . Rebounding was a huge factor as well , with the Pelicans winning that battle , 43 - 34 . Anthony Davis led the Timberwolves in scoring with 42 points on 16 - of - 22 from the field and 8 - of - 11 from the free - throw line . Jrue Holiday was second on the team , as he tallied 25 points , six rebounds and 12 assists . Buddy Hield was second on the team , as he dropped 17 points on 7 - of - 10 shooting . Gorgui Dieng finished with eight points , eight rebounds and three steals . Buddy Hield led Minnesota in scoring , as he provided 17 points and four rebounds on 7 - of - 10 from the field . Gorgui Dieng amassed eight points , eight rebounds and three steals . Minnesota 's next game will be on Friday , when they host the Oklahoma City Thunder for their next game . The Pelicans ( 21 - 33 ) have been one of the worst teams in the league , as this marks their 17th win at Verizon Center . Anthony Davis led the way for Minnesota , as he collected 42 points and 13 rebounds . Jrue Holiday finished second on the team with 25 points , 12 assists and five steals .",1445,"The New Orleans Pelicans defeated the Minnesota Timberwolves, 122-106, at Target Center on Friday. These are two teams going in opposite directions and this result shows just that. In this game, there were 8 ties and 10 lead changes in total, with neither team leading by more than 8 points. Defense was key for the Pelicans, as they held the Timberwolves to 46 percent from the field and 22 percent from three-point range. Rebounding was a huge factor as well, with the Pelicans winning that battle, 43-34. Anthony Davis led the Timberwolves in scoring with 42 points on 16-of-22 from the field and 8-of-11 from the free-throw line. Jrue Holiday was second on the team, as he tallied 25 points, six rebounds and 12 assists. Buddy Hield was second on the team, as he dropped 17 points on 7-of-10 shooting. Gorgui Dieng finished with eight points, eight rebounds and three steals. Buddy Hield led Minnesota in scoring, as he provided 17 points and four rebounds on 7-of-10 from the field. Gorgui Dieng amassed eight points, eight rebounds and three steals. Minnesota's next game will be on Friday, when they host the Oklahoma City Thunder for their next game. The Pelicans (21-33)  have been one of the worst teams in the league, as this marks their 17th win at Verizon Center. Anthony Davis led the way for Minnesota, as he collected 42 points and 13 rebounds. Jrue Holiday finished second on the team with 25 points, 12 assists and five steals.",02_10_17,https://www.basketball-reference.com/boxscores/201702100MIN.html,https://www.basketball-reference.com/teams/MIN/2017_games.html,https://www.basketball-reference.com/teams/NOP/2017_games.html,https://www.timeanddate.com/calendar/monthly.html?year=2017&month=02&country=1,https://mturk-worker-downloads-uoa-nlg.s3.eu-west-2.amazonaws.com/Finding+Mistakes+in+Basketball+S022.docx
16,S023,00_Existing,rebuffel_test_gen_not_paper.txt,Mavericks,Lakers,654,1614,"The Dallas Mavericks defeated the Los Angeles Lakers , 122 - 73 , at American Airlines Center on Wednesday . Dallas was expected to win this game easily and they left no doubt with this result . In fact , the Mavericks led for the entirety of the second half , as they led by 11 at times in the second half . Defense was key for the Mavericks , as they held the Lakers to 38 percent shooting and forced them to commit 17 turnovers . Justin Anderson led the way for Dallas in scoring , as he dropped 19 points off the bench . Justin Anderson led the team in scoring off the bench , as he dropped 19 points on 5 - of - 11 shooting . Deron Williams was the only other starter in double figures , as he accumulated 13 points , five rebounds and eight assists . Justin Anderson led the bench in scoring for 19 points , while adding five rebounds and two assists . Julius Randle recorded a double - double , totaling nine points , six rebounds and four assists . Justin Anderson led the Lakers in scoring off the bench , as he provided 19 points and five rebounds . Julius Randle was the only other Laker in double figures , collecting nine points , six rebounds and four assists . On deck for Los Angeles is a home matchup against the Portland Trail Blazers on Wednesday . The Mavericks ( 15 - 29 ) have now won five - straight games , as they continue to revive their season . Justin Anderson was the player of the game , as he led the team with 19 points and five rebounds on 5 - of - 11 shooting off the bench . Justin Anderson was second on the team , as he dropped 19 points on 5 - of - 11 shooting off the bench .",1560,"The Dallas Mavericks defeated the Los Angeles Lakers, 122-73, at American Airlines Center on Wednesday. Dallas was expected to win this game easily and they left no doubt with this result. In fact, the Mavericks led for the entirety of the second half, as they led by 11 at times in the second half. Defense was key for the Mavericks, as they held the Lakers to 38 percent shooting and forced them to commit 17 turnovers. Justin Anderson led the way for Dallas in scoring, as he dropped 19 points off the bench. Justin Anderson led the team in scoring off the bench, as he dropped 19 points on 5-of-11 shooting. Deron Williams was the only other starter in double figures, as he accumulated 13 points, five rebounds and eight assists. Justin Anderson led the bench in scoring for 19 points, while adding five rebounds and two assists. Julius Randle recorded a double-double, totaling nine points, six rebounds and four assists. Justin Anderson led the Lakers in scoring off the bench, as he provided 19 points and five rebounds. Julius Randle was the only other Laker in double figures, collecting nine points, six rebounds and four assists. On deck for Los Angeles is a home matchup against the Portland Trail Blazers on Wednesday. The Mavericks (15-29)  have now won five-straight games, as they continue to revive their season. Justin Anderson was the player of the game, as he led the team with 19 points and five rebounds on 5-of-11 shooting off the bench. Justin Anderson was second on the team, as he dropped 19 points on 5-of-11 shooting off the bench.",01_22_17,https://www.basketball-reference.com/boxscores/201701220DAL.html,https://www.basketball-reference.com/teams/DAL/2017_games.html,https://www.basketball-reference.com/teams/LAL/2017_games.html,https://www.timeanddate.com/calendar/monthly.html?year=2017&month=01&country=1,https://mturk-worker-downloads-uoa-nlg.s3.eu-west-2.amazonaws.com/Finding+Mistakes+in+Basketball+S023.docx
17,S024,00_Existing,rebuffel_test_gen_not_paper.txt,Warriors,Kings,213,1552,"The Golden State Warriors defeated the Sacramento Kings , 114 - 100 , at Oracle Arena on Saturday . The Warriors ( 58 - 14 ) came into Wednesday 's contest with a golden opportunity to keep their faint playoff hopes alive , as the Kings ( 27 - 45 ) were able to pierce Golden State 's armor Wednesday , touching up Gregg Popovich 's crew for a season - high 114 points . Stephen Curry led the way for the Warriors with 27 points , 12 assists , seven rebounds and six steals . Green followed with 23 points , four rebounds , eight assists , three steals and a block . Skal Labissiere followed with 10 points , eight assists , a rebound and a block in 27 minutes off the bench . The Warriors were led by Buddy Hield 's 22 points , which he supplemented with eight rebounds , seven assists and two steals . Draymond Green posted a 23 - point , 4 - assist double - double that also included four rebounds , three steals and one block . Skal Labissiere led the second unit with 10 points , 10 rebounds , eight assists and one block . Ben McLemore led the second unit with 11 points , one rebound , two assists and one steal . Stephen Curry paced the Kings with a 27 - point , 12 - assist double - double that also included seven rebounds and six steals . Buddy Hield was next with a bench - leading 22 points , which he supplemented with eight assists , eight rebounds and two steals . Draymond Green totaled 23 points , eight assists , four rebounds , three steals and one block . Willie Cauley-Stein totaled 12 points and four rebounds in a reserve role .",1486,"The Golden State Warriors defeated the Sacramento Kings, 114-100, at Oracle Arena on Saturday. The Warriors (58-14)  came into Wednesday's contest with a golden opportunity to keep their faint playoff hopes alive, as the Kings (27-45)  were able to pierce Golden State's armor Wednesday, touching up Gregg Popovich's crew for a season-high 114 points. Stephen Curry led the way for the Warriors with 27 points, 12 assists, seven rebounds and six steals. Green followed with 23 points, four rebounds, eight assists, three steals and a block. Skal Labissiere followed with 10 points, eight assists, a rebound and a block in 27 minutes off the bench. The Warriors were led by Buddy Hield's 22 points, which he supplemented with eight rebounds, seven assists and two steals. Draymond Green posted a 23-point, 4-assist double-double that also included four rebounds, three steals and one block. Skal Labissiere led the second unit with 10 points, 10 rebounds, eight assists and one block. Ben McLemore led the second unit with 11 points, one rebound, two assists and one steal. Stephen Curry paced the Kings with a 27-point, 12-assist double-double that also included seven rebounds and six steals. Buddy Hield was next with a bench-leading 22 points, which he supplemented with eight assists, eight rebounds and two steals. Draymond Green totaled 23 points, eight assists, four rebounds, three steals and one block. Willie Cauley-Stein totaled 12 points and four rebounds in a reserve role.",03_24_17,https://www.basketball-reference.com/boxscores/201703240GSW.html,https://www.basketball-reference.com/teams/GSW/2017_games.html,https://www.basketball-reference.com/teams/SAC/2017_games.html,https://www.timeanddate.com/calendar/monthly.html?year=2017&month=03&country=1,https://mturk-worker-downloads-uoa-nlg.s3.eu-west-2.amazonaws.com/Finding+Mistakes+in+Basketball+S024.docx
18,S025,00_Existing,rebuffel_test_gen_not_paper.txt,Celtics,Spurs,220,1289,"The San Antonio Spurs defeated the Boston Celtics , 109 - 103 , at TD Garden on Friday . The Spurs ( 13 - 3 ) checked in to Thursday 's contest with a mere nine points over the Celtics ( 9 - 7 ) at home , but it was n't enough to keep the Celtics ( 9 - 7 ) to their eighth home victory of the season . Kawhi Leonard led the way for the Spurs , scoring 25 points on 8 - of - 18 shooting , including 3 - of - 7 from three - point range , to go along with 10 rebounds and four assists in 35 minutes . Kawhi Leonard added 25 points , 10 rebounds and four assists , while Patty Mills added 19 points off the bench . Avery Bradley added 19 points on 8 - of - 15 shooting , while David Lee chipped in 15 points off the bench . Isaiah Thomas led the Celtics in scoring , with 24 points , to go along with a rebound and eight assists , in 36 minutes . Avery Bradley followed up with 19 points , eight rebounds and three assists , while David Lee chipped in 15 points on 6 - of - 9 shooting , including 0 - of - 0 from long range . LaMarcus Aldridge finished with 10 points , four rebounds and four assists , in 32 minutes . The Spurs shot 47 percent from the field and 46 percent from long range , while the Celtics shot 46 percent from the field , while the Celtics hit 46 percent of their shots .",1226,"The San Antonio Spurs defeated the Boston Celtics, 109-103, at TD Garden on Friday. The Spurs (13-3)  checked in to Thursday's contest with a mere nine points over the Celtics (9-7)  at home, but it wasn't enough to keep the Celtics (9-7)  to their eighth home victory of the season. Kawhi Leonard led the way for the Spurs, scoring 25 points on 8-of-18 shooting, including 3-of-7 from three-point range, to go along with 10 rebounds and four assists in 35 minutes. Kawhi Leonard added 25 points, 10 rebounds and four assists, while Patty Mills added 19 points off the bench. Avery Bradley added 19 points on 8-of-15 shooting, while David Lee chipped in 15 points off the bench. Isaiah Thomas led the Celtics in scoring, with 24 points, to go along with a rebound and eight assists, in 36 minutes. Avery Bradley followed up with 19 points, eight rebounds and three assists, while David Lee chipped in 15 points on 6-of-9 shooting, including 0-of-0 from long range. LaMarcus Aldridge finished with 10 points, four rebounds and four assists, in 32 minutes. The Spurs shot 47 percent from the field and 46 percent from long range, while the Celtics shot 46 percent from the field, while the Celtics hit 46 percent of their shots.",11_25_16,https://www.basketball-reference.com/boxscores/201611250BOS.html,https://www.basketball-reference.com/teams/BOS/2017_games.html,https://www.basketball-reference.com/teams/SAS/2017_games.html,https://www.timeanddate.com/calendar/monthly.html?year=2016&month=11&country=1,https://mturk-worker-downloads-uoa-nlg.s3.eu-west-2.amazonaws.com/Finding+Mistakes+in+Basketball+S025.docx
19,S026,00_Existing,rebuffel_test_gen_not_paper.txt,Suns,Pacers,105,2338,"The Phoenix Suns ( 11 - 8 ) defeated the David West ( 5 - 12 ) 116 - 0 on Wednesday at the US Airways Center in Phoenix . The Suns got off to a quick start in this one , out - scoring the Pacers 26 - 27 in the first quarter alone . The Suns were the superior shooters in this game , going 50 percent from the field and 48 percent from the three - point line , while the 12 - for - 12 from the free throw line , 0 - for - 3 from beyond the arc . The Suns were led by the duo of Eric Dragic and Goran Dragic . Dragic went 11 - for - 15 from the field and 5 - for - 6 from the three - point line to score a game - high of 34 points , while also adding five rebounds and three steals . It was a season - high in points for Dragic , who recorded his second double - double in the last five games . Dragic had 34 points ( 11 - 15 FG , 5 - 6 3Pt , 7 - 7 FT ) , five rebounds and three assists , while Dragic had 34 points ( 11 - 20 FG , 5 - 6 3Pt , 4 - 7 FT ) , three assists and four steals . It was his second double - double in a row , as he 's combined for 42 points and 11 rebounds over his last two games . Roy Hibbert also had a solid showing , recording 15 points ( 6 - 14 FG , 0 - 0 3Pt , 3 - 3 FT ) , 10 rebounds and two steals . It was his second double - double in a row , as he 's averaged 10 points and 16 rebounds per game . CJ Miles also had a big game off the bench with 17 points ( 6 - 9 FG , 1 - 3 3Pt , 4 - 4 FT ) and a pair of rebounds . It was his second double - double in a row , as he 's combined for 42 points and 12 rebounds over his last two games . Roy Hibbert also had a solid showing , recording 15 points ( 6 - 14 FG , 0 - 0 3Pt , 3 - 3 FT ) , 10 rebounds and two steals . He 's now averaging 10 points and 6 rebounds on the year . CJ Miles had a strong showing off the bench , scoring 17 points ( 6 - 9 FG , 1 - 3 3Pt , 4 - 4 FT ) , to go along with two rebounds and two assists . He 's now averaging 15 points and 6 rebounds on the year . CJ Miles was the only other starter to reach double figures in points . He went 6 - for - 9 from the field and 1 - for - 3 from the three - point line to score 17 points , while also adding seven rebounds and a steal . The Suns ' next game will be at home against the Toronto Raptors on Friday , while the Pacers will be at home against the Brooklyn Nets on Friday .",2183,"The Phoenix Suns (11-8)  defeated the David West (5-12)  116-0 on Wednesday at the US Airways Center in Phoenix. The Suns got off to a quick start in this one, out-scoring the Pacers 26-27 in the first quarter alone. The Suns were the superior shooters in this game, going 50 percent from the field and 48 percent from the three-point line, while the 12-for-12 from the free throw line, 0-for-3 from beyond the arc. The Suns were led by the duo of Eric Dragic and Goran Dragic. Dragic went 11-for-15 from the field and 5-for-6 from the three-point line to score a game-high of 34 points, while also adding five rebounds and three steals. It was a season-high in points for Dragic, who recorded his second double-double in the last five games. Dragic had 34 points (11-15 FG, 5-6 3Pt, 7-7 FT), five rebounds and three assists, while Dragic had 34 points (11-20 FG, 5-6 3Pt, 4-7 FT), three assists and four steals. It was his second double-double in a row, as he's combined for 42 points and 11 rebounds over his last two games. Roy Hibbert also had a solid showing, recording 15 points (6-14 FG, 0-0 3Pt, 3-3 FT), 10 rebounds and two steals. It was his second double-double in a row, as he's averaged 10 points and 16 rebounds per game. CJ Miles also had a big game off the bench with 17 points (6-9 FG, 1-3 3Pt, 4-4 FT)  and a pair of rebounds. It was his second double-double in a row, as he's combined for 42 points and 12 rebounds over his last two games. Roy Hibbert also had a solid showing, recording 15 points (6-14 FG, 0-0 3Pt, 3-3 FT), 10 rebounds and two steals. He's now averaging 10 points and 6 rebounds on the year. CJ Miles had a strong showing off the bench, scoring 17 points (6-9 FG, 1-3 3Pt, 4-4 FT), to go along with two rebounds and two assists. He's now averaging 15 points and 6 rebounds on the year. CJ Miles was the only other starter to reach double figures in points. He went 6-for-9 from the field and 1-for-3 from the three-point line to score 17 points, while also adding seven rebounds and a steal. The Suns ' next game will be at home against the Toronto Raptors on Friday, while the Pacers will be at home against the Brooklyn Nets on Friday.",12_02_14,https://www.basketball-reference.com/boxscores/201412020PHO.html,https://www.basketball-reference.com/teams/PHO/2015_games.html,https://www.basketball-reference.com/teams/IND/2015_games.html,https://www.timeanddate.com/calendar/monthly.html?year=2014&month=12&country=1,https://mturk-worker-downloads-uoa-nlg.s3.eu-west-2.amazonaws.com/Finding+Mistakes+in+Basketball+S026.docx
20,S027,00_Existing,rebuffel_test_gen_not_paper.txt,Knicks,Rockets,512,1274,"The New York Knicks ( 8 - 10 ) defeated the Houston Rockets ( 7 - 10 ) 111 - 111 on Wednesday at Madison Square Garden in New York . The Knicks got off to a quick start in this one , out - scoring the Knicks 25 - 21 in the first quarter alone . The Rockets were the superior shooters in this game , going 58 percent from the field and 33 percent from the three - point line , while the Rockets went 58 percent from the floor and 33 percent from beyond the arc . The Knicks were led by Arron Afflalo , who went 13 - for - 19 from the field and 2 - for - 4 from the three - point line to score a game - high of 31 points , while also adding seven rebounds and three assists . It was his second straight game with a career - high of 31 points ( 13 - 19 FG , 2 - 4 3Pt , 3 - 4 FT ) of his own , while also adding seven rebounds . It was his second double - double in a row , as he 's combined for 45 points and 10 rebounds over his last two games . Kristaps Porzingis was the only other starter in double figures , finishing with 20 points ( 8 - 13 FG , 0 - 1 3Pt , 4 - 4 FT ) , 13 rebounds and two blocked shots . The Rockets ' next game will be on the road against the Detroit Pistons on Wednesday , while the Knicks will travel to Charlotte to play the Hornets on Wednesday .",1207,"The New York Knicks (8-10)  defeated the Houston Rockets (7-10)  111-111 on Wednesday at Madison Square Garden in New York. The Knicks got off to a quick start in this one, out-scoring the Knicks 25-21 in the first quarter alone. The Rockets were the superior shooters in this game, going 58 percent from the field and 33 percent from the three-point line, while the Rockets went 58 percent from the floor and 33 percent from beyond the arc. The Knicks were led by Arron Afflalo, who went 13-for-19 from the field and 2-for-4 from the three-point line to score a game-high of 31 points, while also adding seven rebounds and three assists. It was his second straight game with a career-high of 31 points (13-19 FG, 2-4 3Pt, 3-4 FT)  of his own, while also adding seven rebounds. It was his second double-double in a row, as he's combined for 45 points and 10 rebounds over his last two games. Kristaps Porzingis was the only other starter in double figures, finishing with 20 points (8-13 FG, 0-1 3Pt, 4-4 FT), 13 rebounds and two blocked shots. The Rockets ' next game will be on the road against the Detroit Pistons on Wednesday, while the Knicks will travel to Charlotte to play the Hornets on Wednesday.",11_29_15,https://www.basketball-reference.com/boxscores/201511290NYK.html,https://www.basketball-reference.com/teams/NYK/2016_games.html,https://www.basketball-reference.com/teams/HOU/2016_games.html,https://www.timeanddate.com/calendar/monthly.html?year=2015&month=11&country=1,https://mturk-worker-downloads-uoa-nlg.s3.eu-west-2.amazonaws.com/Finding+Mistakes+in+Basketball+S027.docx
